<?xml version="1.0" encoding="UTF-8" standalone="no"?>
<PluginInfo xmlns:xlink="http://www.w3.org/1999/xlink"
        xmlns:xsd="http://www.w3.org/2001/XMLSchema-instance"
        xmlns="http://www.terralib.org/schemas/plugin"
        xsd:schemaLocation="http://www.terralib.org/schemas/plugin ../../../../myschemas/terralib/plugin/plugin_info.xsd"
        version="5.0.0-20110110"
        release="2011-01-01"
        engine="C++">
  <Name>te.js.plugin</Name>
  <DisplayName>.......</DisplayName>
  <Description>This plugin enables TerraLib to ...</Description>
  <TerraLibVersion>5.0.0-20100101</TerraLibVersion>
  <License xlink:href="http://www.gnu.org/licenses/lgpl-3.0-standalone.html">GNU Lesser General Public License v 3.0</License>
  <Category>Bindings</Category>
  <Site xlink:href="http://www.dpi.inpe.br/terralib5/wiki/doku.php?id=wiki:designimplementation:dataaccess:postgis"></Site>
  <Provider>
    <Name>Terralib Team</Name>
    <Site xlink:href="http://www.terralib.org/"></Site>
    <Email>terralib-team@terralib.org</Email>
  </Provider>
  <Resources>
    <Resource name="SharedLibraryName" xlink:href="terralib_binding_v8_plugin"></Resource>
  </Resources>
</PluginInfo>